[{"annotators":["human:synthetic-author"],"case_id":"case:synthetic:1","direction":"directed","label":"positive","member_subtype":null,"note":"Synthetic gold label; not historical evidence.","relation_type":"student_teacher","source_entity_id":"person:bora_example","source_id":"source:synthetic_meridian_note","source_sha256":"87abdce55610c805edcbb0f169c54de090c66ac7690652163b221d013a88eadd","split":"pilot","target_entity_id":"person:aylin_demo"},{"annotators":["human:synthetic-author"],"case_id":"case:synthetic:2","direction":"undirected","label":"positive","member_subtype":null,"note":"Synthetic gold label; not historical evidence.","relation_type":"academic_output","source_entity_id":"person:aylin_demo","source_id":"source:synthetic_meridian_note","source_sha256":"87abdce55610c805edcbb0f169c54de090c66ac7690652163b221d013a88eadd","split":"pilot","target_entity_id":"person:bora_example"},{"annotators":["human:synthetic-author"],"case_id":"case:synthetic:3","direction":"undirected","label":"positive","member_subtype":null,"note":"Synthetic gold label; not historical evidence.","relation_type":"in_same_context","source_entity_id":"person:aylin_demo","source_id":"source:synthetic_meridian_note","source_sha256":"87abdce55610c805edcbb0f169c54de090c66ac7690652163b221d013a88eadd","split":"pilot","target_entity_id":"person:cem_sample"}]
